{
  "id": "hoard",
  "apiVersion": 4,
  "renderer": "renderer.js",
  "main": "main.cjs",
  "commands": [
    { "id": "keep-history", "title": "Keep Library History" },
    { "id": "check-findings", "title": "Library Check Findings" },
    { "id": "add-comment", "title": "Add Comment" },
    { "id": "import-wiki", "title": "Import to Wiki…" },
    { "id": "open-wiki", "title": "Edit Wiki as a Book" },
    { "id": "follow-link", "title": "Follow Link" },
    { "id": "search-library", "title": "Search Library…" }
  ],
  "style": "style.css"
}
